title,imdb,Genre,year,duration,certificate,description,Director,Stars
All That Jazz,78,Drama,1979,123,R,"Director/choreographer Bob Fosse tells his own life story as he details the sordid career of Joe Gideon, a womanizing, drug-using dancer.",Director: Bob Fosse ," Stars: Roy Scheider, Jessica Lange, Ann Reinking, Leland Palmer"
Batman: Mask of the Phantasm,78,Animation,1993,76,PG,Batman is wrongly implicated in a series of murders of mob bosses actually committed by a new vigilante assassin.,"Directors: Kevin Altieri, Boyd Kirkland, Frank Paur, Dan Riba, Eric Radomski, Bruce Timm "," Stars: Kevin Conroy, Dana Delany, Hart Bochner, Stacy Keach"
The Outlaw Josey Wales,78,Western,1976,135,PG,Missouri farmer Josey Wales joins a Confederate guerrilla unit and winds up on the run from the Union soldiers who murdered his family.,Director: Clint Eastwood ," Stars: Clint Eastwood, Sondra Locke, Chief Dan George, Bill McKinney"
Cabaret,78,Drama,1972,124,PG,A female girlie club entertainer in Weimar Republic era Berlin romances two men while the Nazi Party rises to power around them.,Director: Bob Fosse ," Stars: Liza Minnelli, Michael York, Helmut Griem, Joel Grey"
The Right Stuff,78,Adventure,1983,193,PG,"The U.S. space program's development from the breaking of the sound barrier to selection of the Mercury 7 astronauts, from a group of test pilots with a more seat-of-the-pants approach than the program's more cautious engineers preferred.",Director: Philip Kaufman ," Stars: Sam Shepard, Scott Glenn, Ed Harris, Dennis Quaid"
Manhattan,78,Comedy,1979,96,R,The life of a divorced television writer dating a teenage girl is further complicated when he falls in love with his best friend's mistress.,Director: Woody Allen ," Stars: Woody Allen, Diane Keaton, Mariel Hemingway, Michael Murphy"
Days of Heaven,78,Drama,1978,94,PG,A hot-tempered farm laborer convinces the woman he loves to marry their rich but dying boss so that they can have a claim to his fortune.,Director: Terrence Malick ," Stars: Richard Gere, Brooke Adams, Sam Shepard, Linda Manz"
The Day the Earth Stood Still,78,Drama,1951,92,G,"An alien lands in Washington, D.C. and tells the people of Earth that they must live peacefully or be destroyed as a danger to other planets.",Director: Robert Wise ," Stars: Michael Rennie, Patricia Neal, Hugh Marlowe, Sam Jaffe"
Hannah and Her Sisters,78,Comedy,1986,107,PG-13,"Between two Thanksgivings two years apart, Hannah's husband falls in love with her sister Lee, while her hypochondriac ex-husband rekindles his relationship with her sister Holly.",Director: Woody Allen ," Stars: Mia Farrow, Dianne Wiest, Michael Caine, Barbara Hershey"
Breaking the Waves,78,Drama,1996,159,R,"Oilman Jan is paralyzed in an accident. His wife, who prayed for his return, feels guilty; even more, when Jan urges her to have sex with another.",Director: Lars von Trier ," Stars: Emily Watson, Stellan Skarsgård, Katrin Cartlidge, Jean-Marc Barr"
Letters from Iwo Jima,78,Action,2006,141,R,"The story of the battle of Iwo Jima between the United States and Imperial Japan during World War II, as told from the perspective of the Japanese who fought it.",Director: Clint Eastwood ," Stars: Ken Watanabe, Kazunari Ninomiya, Tsuyoshi Ihara, Ryo Kase"
The Killing Fields,78,Biography,1984,141,R,"A journalist is trapped in Cambodia during tyrant Pol Pot's bloody 'Year Zero' cleansing campaign, which claimed the lives of two million 'undesirable' civilians.",Director: Roland Joffé ," Stars: Sam Waterston, Haing S. Ngor, John Malkovich, Julian Sands"
Once,78,Drama,I 2007,86,R,"A modern-day musical about a busker and an immigrant and their eventful week in Dublin, as they write, rehearse and record songs that tell their love story.",Director: John Carney ," Stars: Glen Hansard, Markéta Irglová, Hugh Walsh, Gerard Hendrick"
The Chaser,78,Action,2008,125,Not Rated,A disgraced ex-policeman who runs a small ring of prostitutes finds himself in a race against time when one of his women goes missing.,Director: Na Hong-jin ," Stars: Kim Yoon-seok, Ha Jung-woo, Yeong-hie Seo, Kim Yoo-jung"
Loving Vincent,78,Animation,2017,94,PG-13,"In a story depicted in oil painted animation, a young man comes to the last hometown of painter Vincent van Gogh to deliver the troubled artist's final letter and ends up investigating his final days there.","Directors: DK Welchman, Hugh Welchman "," Stars: Douglas Booth, Jerome Flynn, Robert Gulaczyk, Helen McCrory"
Whisper of the Heart,78,Animation,1995,111,G,"A love story between a girl who loves reading books, and a boy who has previously checked out all of the library books she chooses.",Director: Yoshifumi Kondô ," Stars: Yoko Honna, Issey Takahashi, Takashi Tachibana, Shigeru Muroi"
Shadow of a Doubt,78,Film-Noir,1943,108,Passed,"A teenage girl, overjoyed when her favorite uncle comes to visit the family in their quiet California town, slowly begins to suspect that he is in fact the ""Merry Widow"" killer sought by the authorities.",Director: Alfred Hitchcock ," Stars: Teresa Wright, Joseph Cotten, Macdonald Carey, Henry Travers"
Red River,78,Drama,1948,133,Passed,"Dunson leads a cattle drive, the culmination of over 14 years of work, to its destination in Missouri. But his tyrannical behavior along the way causes a mutiny, led by his adopted son.","Directors: Howard Hawks, Arthur Rosson "," Stars: John Wayne, Montgomery Clift, Joanne Dru, Walter Brennan"
My Left Foot,78,Biography,1989,103,R,"Christy Brown, born with cerebral palsy, learns to paint and write with his only controllable limb - his left foot.",Director: Jim Sheridan ," Stars: Daniel Day-Lewis, Brenda Fricker, Alison Whelan, Kirsten Sheridan"
The World's Fastest Indian,78,Biography,2005,127,PG-13,"The story of New Zealander Burt Munro, who spent years rebuilding a 1920 Indian motorcycle, which helped him set the land speed world record at Utah's Bonneville Salt Flats in 1967.",Director: Roger Donaldson ," Stars: Anthony Hopkins, Diane Ladd, Iain Rea, Tessa Mitchell"
Lilya 4-Ever,78,Crime,2002,109,R,"Sixteen-year-old Lilja and her only friend, the young boy Volodja, live in Russia, fantasizing about a better life. One day, Lilja falls in love with Andrej, who is going to Sweden, and invites Lilja to come along and start a new life.",Director: Lukas Moodysson ," Stars: Oksana Akinshina, Artyom Bogucharskiy, Pavel Ponomaryov, Lyubov Agapova"
To Have and Have Not,78,Adventure,1944,100,Passed,"During World War II, American expatriate Harry Morgan helps transport a French Resistance leader and his beautiful wife to Martinique while romancing a sensuous lounge singer.",Director: Howard Hawks ," Stars: Humphrey Bogart, Lauren Bacall, Walter Brennan, Dolores Moran"
The Bride of Frankenstein,78,Drama,1935,75,Not Rated,"Mary Shelley reveals the main characters of her novel survived: Dr. Frankenstein, goaded by an even madder scientist, builds his monster a mate.",Director: James Whale ," Stars: Boris Karloff, Elsa Lanchester, Colin Clive, Valerie Hobson"
All About My Mother,78,Comedy,1999,101,R,"Pedro Almodovar's Oscar-winning comedy (Best Foreign Film, 1999) about a bereaved mother, and overwrought actress, her jealous lover and a pregnant nun.",Director: Pedro Almodóvar ," Stars: Cecilia Roth, Marisa Paredes, Candela Peña, Antonia San Juan"
Pride,78,Biography,I 2014,119,R,U.K. gay activists work to help miners during their lengthy strike of the National Union of Mineworkers in the summer of 1984.,Director: Matthew Warchus ," Stars: Bill Nighy, Imelda Staunton, Dominic West, Paddy Considine"
Land of Mine,78,Drama,2015,100,R,"In post-World War II Denmark, a group of young German POWs are forced to clear a beach of thousands of land mines under the watch of a Danish Sergeant who slowly learns to appreciate their plight.",Director: Martin Zandvliet ," Stars: Roland Møller, Louis Hofmann, Joel Basman, Mikkel Boe Følsgaard"
East of Eden,78,Drama,1955,118,PG,"Two brothers in 1910s California struggle to maintain their strict, Bible-toting father's favor as an old secret about their long-absent mother comes to light.",Director: Elia Kazan ," Stars: James Dean, Raymond Massey, Julie Harris, Burl Ives"
The Umbrellas of Cherbourg,78,Drama,1964,91,Not Rated,A young woman separated from her lover by war faces a life-altering decision.,Director: Jacques Demy ," Stars: Catherine Deneuve, Nino Castelnuovo, Anne Vernon, Marc Michel"
Ninja Scroll,78,Animation,1993,94,Not Rated,A vagabond swordsman is aided by a kunoichi and a spy in battling a demonic clan of killers - led by a ghost from his past - who are bent on overthrowing the Tokugawa Shogunate.,Director: Yoshiaki Kawajiri ," Stars: Kôichi Yamadera, Emi Shinohara, Takeshi Aono, Osamu Saka"
The White Ribbon,78,Drama,2009,144,R,"Strange events happen in a small village in the north of Germany during the years before World War I, which seem to be ritual punishment. Who is responsible?",Director: Michael Haneke ," Stars: Christian Friedel, Ernst Jacobi, Leonie Benesch, Ulrich Tukur"
The Man Who Would Be King,78,Adventure,1975,129,PG,"Two former British soldiers in 1880s India decide to set themselves up as Kings in Kafiristan, a land where no white man has set foot since Alexander the Great.",Director: John Huston ," Stars: Sean Connery, Michael Caine, Christopher Plummer, Saeed Jaffrey"
A Prophet,78,Crime,2009,155,R,A young Algerian man is sent to a French prison.,Director: Jacques Audiard ," Stars: Tahar Rahim, Niels Arestrup, Adel Bencherif, Reda Kateb"
Cowboy Bebop: The Movie,78,Animation,2001,115,TV-14,"A terrorist explosion releases a deadly virus on the masses, and it's up to the bounty-hunting Bebop crew to catch the cold-blooded culprit.","Directors: Shin'ichirô Watanabe, Mary Elizabeth McGlynn, Tensai Okamura, Hiroyuki Okiura, Yoshiyuki Takei "," Stars: Beau Billingslea, Melissa Fahn, Nicholas Guest, Kôichi Yamadera"
The Innocents,78,Horror,1961,100,Not Rated,A young governess for two children becomes convinced that the house and grounds are haunted.,Director: Jack Clayton ," Stars: Deborah Kerr, Peter Wyngarde, Megs Jenkins, Michael Redgrave"
Guess Who's Coming to Dinner,78,Comedy,1967,108,Approved,A couple's attitudes are challenged when their daughter introduces them to her African-American fiancé.,Director: Stanley Kramer ," Stars: Spencer Tracy, Sidney Poitier, Katharine Hepburn, Katharine Houghton"
"I, Daniel Blake",78,Drama,2016,100,R,"After surviving a heart-attack, a 59-year-old carpenter must fight bureaucratic forces to receive Employment and Support Allowance.",Director: Ken Loach ," Stars: Dave Johns, Hayley Squires, Sharon Percy, Briana Shann"
Bringing Up Baby,78,Comedy,1938,102,Passed,"While trying to secure a $1 million donation for his museum, a befuddled paleontologist is pursued by a flighty and often irritating heiress and her pet leopard, Baby.",Director: Howard Hawks ," Stars: Katharine Hepburn, Cary Grant, Charles Ruggles, Walter Catlett"
The Asphalt Jungle,78,Crime,1950,112,Passed,"A major heist goes off as planned, but then double crosses, bad luck and solid police work cause everything to unravel.",Director: John Huston ," Stars: Sterling Hayden, Louis Calhern, Jean Hagen, James Whitmore"
His Girl Friday,78,Comedy,1939,92,Passed,A newspaper editor uses every trick in the book to keep his ace reporter ex-wife from remarrying.,Director: Howard Hawks ," Stars: Cary Grant, Rosalind Russell, Ralph Bellamy, Gene Lockhart"
The Killer,78,Action,1989,111,R,A disillusioned assassin accepts one last hit in hopes of using his earnings to restore vision to a singer he accidentally blinded.,Director: John Woo ," Stars: Chow Yun-Fat, Danny Lee, Sally Yeh, Kong Chu"
The Lunchbox,78,Drama,2013,104,PG,A mistaken delivery in Mumbai's famously efficient lunchbox delivery system connects a young housewife to an older man in the dusk of his life as they build a fantasy world together through notes in the lunchbox.,Director: Ritesh Batra ," Stars: Irrfan Khan, Nimrat Kaur, Nawazuddin Siddiqui, Lillete Dubey"
You Can't Take It with You,78,Comedy,1938,126,Passed,"The son of a snobbish Wall Street banker becomes engaged to a woman from a good-natured but decidedly eccentric family, not realizing that his father is trying to force her family from their home for a real estate development.",Director: Frank Capra ," Stars: Jean Arthur, James Stewart, Lionel Barrymore, Edward Arnold"
The Discreet Charm of the Bourgeoisie,78,Comedy,1972,102,PG,"A surreal, virtually plotless series of dreams centered around six middle-class people and their consistently interrupted attempts to have a meal together.",Director: Luis Buñuel ," Stars: Fernando Rey, Delphine Seyrig, Paul Frankeur, Bulle Ogier"
Millennium Actress,78,Animation,2001,87,PG,A TV interviewer and his cameraman meet a former actress and travel through her memories and career.,Director: Satoshi Kon ," Stars: Miyoko Shôji, Shôzô Îzuka, Mami Koyama, Fumiko Orikasa"
The Chorus,78,Drama,2004,97,PG-13,The new teacher at a severely administered boys' boarding school works to positively affect the students' lives through music.,Director: Christophe Barratier ," Stars: Gérard Jugnot, François Berléand, Jean-Baptiste Maunier, Kad Merad"
The Postman,78,Biography,1994,108,PG,"A simple Italian postman learns to love poetry while delivering mail to a famous poet, and then uses this to woo local beauty Beatrice.","Directors: Michael Radford, Massimo Troisi "," Stars: Massimo Troisi, Philippe Noiret, Maria Grazia Cucinotta, Renato Scarpa"
Crimes and Misdemeanors,78,Comedy,1989,104,PG-13,An ophthalmologist's mistress threatens to reveal their affair to his wife while a married documentary filmmaker is infatuated with another woman.,Director: Woody Allen ," Stars: Martin Landau, Woody Allen, Bill Bernstein, Claire Bloom"
Tokyo Godfathers,78,Animation,2003,92,PG-13,"On Christmas Eve, three homeless people living on the streets of Tokyo discover a newborn baby among the trash and set out to find its parents.",Director: Satoshi Kon ," Stars: Tôru Emori, Yoshiaki Umegaki, Aya Okamoto, Shôzô Îzuka"
Vivre Sa Vie,78,Drama,1962,85,Not Rated,Twelve episodic tales in the life of a Parisian woman and her slow descent into prostitution.,Director: Jean-Luc Godard ," Stars: Anna Karina, Sady Rebbot, André S. Labarthe, Guylaine Schlumberger"
"Like Father, Like Son",78,Drama,2013,121,Not Rated,"Ryota is a successful workaholic businessman. When he learns that his biological son was switched with another boy after birth, he faces the difficult decision to choose his true son or the boy he and his wife have raised as their own.",Director: Hirokazu Koreeda ," Stars: Masaharu Fukuyama, Machiko Ono, Yôko Maki, Lily Franky"
Duck Soup,78,Comedy,1933,69,Not Rated,"Rufus T. Firefly is named the dictator of bankrupt Freedonia and declares war on neighboring Sylvania over the love of his wealthy backer Mrs. Teasdale, contending with two inept spies who can't seem to keep straight which side they're on.",Director: Leo McCarey ," Stars: Groucho Marx, Harpo Marx, Chico Marx, Zeppo Marx"
Once Upon a Time in Anatolia,78,Crime,2011,157,Not Rated,A group of men set out in search of a dead body in the Anatolian steppes.,Director: Nuri Bilge Ceylan ," Stars: Muhammet Uzuner, Yilmaz Erdogan, Taner Birsel, Ahmet Mümtaz Taylan"
Veer Zaara,78,Drama,2004,192,Not Rated,"""Veer-Zaara"" is a saga of love, separation, courage, and sacrifice. A love story that is an inspiration and will remain a legend forever.",Director: Yash Chopra ," Stars: Shah Rukh Khan, Preity G Zinta, Rani Mukerji, Kirron Kher"
L'Avventura,78,Drama,1960,144,Not Rated,"A woman disappears during a Mediterranean boating trip. During the search, her lover and her best friend become attracted to each other.",Director: Michelangelo Antonioni ," Stars: Gabriele Ferzetti, Monica Vitti, Lea Massari, Dominique Blanchar"
Knockin' on Heaven's Door,78,Action,1997,87,Not Rated,"Two terminally ill patients escape from a hospital, steal a car and rush towards the sea.",Director: Thomas Jahn ," Stars: Til Schweiger, Jan Josef Liefers, Thierry van Werveke, Moritz Bleibtreu"
My Life as a Zucchini,78,Animation,2016,70,PG-13,"After losing his mother, a young boy is sent to an orphanage with other orphans his age where he begins to learn the meaning of trust and true love.",Director: Claude Barras ," Stars: Gaspard Schlatter, Sixtine Murat, Paulin Jaccoud, Michel Vuillermoz"
A Night at the Opera,78,Comedy,1935,96,Passed,A sly business manager and the wacky friends of two opera singers in Italy help them achieve success in America while humiliating their stuffy and snobbish enemies.,"Directors: Sam Wood, Edmund Goulding "," Stars: Groucho Marx, Chico Marx, Harpo Marx, Kitty Carlisle"
English Vinglish,78,Comedy,2012,134,Not Rated,"A quiet, sweet tempered housewife endures small slights from her well-educated husband and daughter every day because of her inability to speak and understand English.",Director: Gauri Shinde ," Stars: Sridevi, Adil Hussain, Mehdi Nebbou, Priya Anand"
Vicky Donor,78,Comedy,2012,126,Not Rated,"A man is brought in by an infertility doctor to supply him with his sperm, where he becomes the biggest sperm donor for his clinic.",Director: Shoojit Sircar ," Stars: Ayushmann Khurrana, Yami Gautam, Annu Kapoor, Dolly Ahluwalia"
Hindi Medium,78,Comedy,2017,132,Not Rated,A couple from Chandni Chowk aspire to give their daughter the best education and thus be a part of and accepted by the elite of Delhi.,Director: Saket Chaudhary ," Stars: Irrfan Khan, Saba Qamar, Dishita Sehgal, Deepak Dobriyal"
The Whale,77,Drama,2022,117,R,"A reclusive, morbidly obese English teacher attempts to reconnect with his estranged teenage daughter.",Director: Darren Aronofsky ," Stars: Brendan Fraser, Sadie Sink, Ty Simpkins, Hong Chau"
Wind River,77,Crime,2017,107,R,"A wildlife officer, who is haunted by a tragedy that happened because of him, teams up with an FBI agent in solving a murder of a young woman on a Wyoming Native American reservation and hopes to get redemption from his past regrets.",Director: Taylor Sheridan ," Stars: Elizabeth Olsen, Jeremy Renner, Graham Greene, Kelsey Asbille"
The Banshees of Inisherin,77,Comedy,2022,114,R,"Two lifelong friends find themselves at an impasse when one abruptly ends their relationship, with alarming consequences for both of them.",Director: Martin McDonagh ," Stars: Colin Farrell, Brendan Gleeson, Kerry Condon, Pat Shortt"
The Hangover,77,Comedy,2009,100,R,"Three buddies wake up from a bachelor party in Las Vegas, with no memory of the previous night and the bachelor missing. They make their way around the city in order to find their friend before his wedding.",Director: Todd Phillips ," Stars: Zach Galifianakis, Bradley Cooper, Justin Bartha, Ed Helms"
Aftersun,77,Drama,II 2022,102,R,Sophie reflects on the shared joy and private melancholy of a holiday she took with her father twenty years earlier. Memories real and imagined fill the gaps between as she tries to reconcile the father she knew with the man she didn't...,Director: Charlotte Wells ," Stars: Paul Mescal, Frankie Corio, Celia Rowlson-Hall, Sally Messham"
The Goonies,77,Adventure,1985,114,PG,A group of young misfits called The Goonies discover an ancient map and set out on an adventure to find a legendary pirate's long-lost treasure.,Director: Richard Donner ," Stars: Sean Astin, Josh Brolin, Jeff Cohen, Corey Feldman"
Lost in Translation,77,Comedy,2003,102,R,A faded movie star and a neglected young woman form an unlikely bond after crossing paths in Tokyo.,Director: Sofia Coppola ," Stars: Bill Murray, Scarlett Johansson, Giovanni Ribisi, Anna Faris"
Man on Fire,77,Action,2004,146,R,"In Mexico City, a former CIA operative swears vengeance on those who committed an unspeakable act against the family he was hired to protect.",Director: Tony Scott ," Stars: Denzel Washington, Christopher Walken, Dakota Fanning, Radha Mitchell"
Harry Potter and the Goblet of Fire,77,Adventure,2005,157,PG-13,"Harry Potter finds himself competing in a hazardous tournament between rival schools of magic, but he is distracted by recurring nightmares.",Director: Mike Newell ," Stars: Daniel Radcliffe, Emma Watson, Rupert Grint, Eric Sykes"
Halloween,77,Horror,1978,91,R,"Fifteen years after murdering his sister on Halloween night 1963, Michael Myers escapes from a mental hospital and returns to the small town of Haddonfield, Illinois to kill again.",Director: John Carpenter ," Stars: Donald Pleasence, Jamie Lee Curtis, Tony Moran, Nancy Kyes"
Sicario,77,Action,2015,121,R,An idealistic FBI agent is enlisted by a government task force to aid in the escalating war against drugs at the border area between the U.S. and Mexico.,Director: Denis Villeneuve ," Stars: Emily Blunt, Josh Brolin, Benicio Del Toro, Jon Bernthal"
Kingsman: The Secret Service,77,Action,2014,129,R,"A spy organisation recruits a promising street kid into the agency's training program, while a global threat emerges from a twisted tech genius.",Director: Matthew Vaughn ," Stars: Colin Firth, Taron Egerton, Samuel L. Jackson, Michael Caine"
Zodiac,77,Crime,2007,157,R,"Between 1968 and 1983, a San Francisco cartoonist becomes an amateur detective obsessed with tracking down the Zodiac Killer, an unidentified individual who terrorizes Northern California with a killing spree.",Director: David Fincher ," Stars: Jake Gyllenhaal, Robert Downey Jr., Mark Ruffalo, Anthony Edwards"
Coraline,77,Animation,2009,100,PG,"An adventurous 11-year-old girl finds another world that is a strangely idealized version of her frustrating home, but it has sinister secrets.",Director: Henry Selick ," Stars: Dakota Fanning, Teri Hatcher, John Hodgman, Jennifer Saunders"
Ocean's Eleven,77,Crime,2001,116,PG-13,Danny Ocean and his ten accomplices plan to rob three Las Vegas casinos simultaneously.,Director: Steven Soderbergh ," Stars: George Clooney, Brad Pitt, Julia Roberts, Matt Damon"
The French Connection,77,Action,1971,104,R,"A pair of NYPD detectives in the Narcotics Bureau stumble onto a heroin smuggling ring based in Marseilles, but stopping them and capturing their leaders proves an elusive goal.",Director: William Friedkin ," Stars: Gene Hackman, Roy Scheider, Fernando Rey, Tony Lo Bianco"
Naked,77,Comedy,1993,131,Not Rated,An unemployed Mancunian vents his rage on unsuspecting strangers as he embarks on a nocturnal London odyssey.,Director: Mike Leigh ," Stars: David Thewlis, Lesley Sharp, Katrin Cartlidge, Greg Cruttwell"
Training Day,77,Action,2001,122,R,A rookie cop spends his first day as a Los Angeles narcotics officer with a rogue detective who isn't what he appears to be.,Director: Antoine Fuqua ," Stars: Denzel Washington, Ethan Hawke, Scott Glenn, Tom Berenger"
Mission: Impossible - Fallout,77,Action,2018,147,PG-13,"Ethan Hunt and his IMF team, along with some familiar allies, race against time after a mission gone wrong.",Director: Christopher McQuarrie ," Stars: Tom Cruise, Henry Cavill, Ving Rhames, Simon Pegg"
The Name of the Rose,77,Drama,1986,130,R,An intellectually nonconformist friar investigates a series of mysterious deaths in an isolated abbey.,Director: Jean-Jacques Annaud ," Stars: Sean Connery, Christian Slater, Helmut Qualtinger, Elya Baskin"
Mr. Nobody,77,Drama,2009,141,R,"A boy stands on a station platform as a train is about to leave. Should he go with his mother or stay with his father? Infinite possibilities arise from this decision. As long as he doesn't choose, anything is possible.",Director: Jaco Van Dormael ," Stars: Jared Leto, Sarah Polley, Diane Kruger, Linh-Dan Pham"
Harry Potter and the Deathly Hallows: Part 1,77,Adventure,2010,146,PG-13,"As Harry, Ron and Hermione race against time and evil to destroy the Horcruxes, they uncover the existence of the three most powerful objects in the wizarding world: the Deathly Hallows.",Director: David Yates ," Stars: Daniel Radcliffe, Emma Watson, Rupert Grint, Bill Nighy"
Blue Is the Warmest Colour,77,Drama,2013,180,NC-17,"Adèle's life is changed when she meets Emma, a young woman with blue hair, who will allow her to discover desire and to assert herself as a woman and as an adult. In front of others, Adèle grows, seeks herself, loses herself, and ultimately finds herself through love and loss.",Director: Abdellatif Kechiche ," Stars: Léa Seydoux, Adèle Exarchopoulos, Salim Kechiouche, Aurélien Recoing"
When Harry Met Sally...,77,Comedy,1989,95,R,"Harry and Sally have known each other for years, and are very good friends, but they fear sex would ruin the friendship.",Director: Rob Reiner ," Stars: Billy Crystal, Meg Ryan, Carrie Fisher, Bruno Kirby"
Black Hawk Down,77,Action,2001,144,R,"The story of 160 elite U.S. soldiers who dropped into Mogadishu in October 1993 to capture two top lieutenants of a renegade warlord, but found themselves in a desperate battle with a large force of heavily armed Somalis.",Director: Ridley Scott ," Stars: Josh Hartnett, Ewan McGregor, Tom Sizemore, Eric Bana"
Home Alone,77,Comedy,1990,103,PG,"An eight-year-old troublemaker, mistakenly left home alone, must defend his home against a pair of burglars on Christmas eve.",Director: Chris Columbus ," Stars: Macaulay Culkin, Joe Pesci, Daniel Stern, John Heard"
500 Days of Summer,77,Comedy,2009,95,PG-13,"After being dumped by the girl he believes to be his soulmate, hopeless romantic Tom Hansen reflects on their relationship to try and figure out where things went wrong and how he can win her back.",Director: Marc Webb ," Stars: Zooey Deschanel, Joseph Gordon-Levitt, Geoffrey Arend, Chloë Grace Moretz"
