title,imdb,Genre,year,duration,certificate,description,Director,Stars
My Neighbor Totoro,81,Animation,1988,86,G,"When two girls move to the country to be near their ailing mother, they have adventures with the wondrous forest spirits who live nearby.",Director: Hayao Miyazaki ," Stars: Hitoshi Takagi, Noriko Hidaka, Chika Sakamoto, Shigesato Itoi"
Network,81,Drama,1976,121,R,"A television network cynically exploits a deranged former anchor's ravings and revelations about the news media for its own profit, but finds that his message may be difficult to control.",Director: Sidney Lumet ," Stars: Faye Dunaway, William Holden, Peter Finch, Robert Duvall"
Before Sunset,81,Drama,2004,80,R,"Nine years after Jesse and Celine first met, they encounter each other again on the French leg of Jesse's book tour.",Director: Richard Linklater ," Stars: Ethan Hawke, Julie Delpy, Vernon Dobtcheff, Louise Lemoine Torrès"
Stalker,81,Drama,1979,162,Not Rated,A guide leads two men through an area known as the Zone to find a room that grants wishes.,Director: Andrei Tarkovsky ," Stars: Alisa Freyndlikh, Aleksandr Kaydanovskiy, Anatoliy Solonitsyn, Nikolay Grinko"
Wild Tales,81,Comedy,2014,122,R,Six short stories that explore the extremities of human behavior involving people in distress.,Director: Damián Szifron ," Stars: Darío Grandinetti, María Marull, Mónica Villa, Diego Starosta"
The Seventh Seal,81,Drama,1957,96,Not Rated,"A knight returning to Sweden after the Crusades seeks answers about life, death, and the existence of God as he plays chess against the Grim Reaper during the Black Plague.",Director: Ingmar Bergman ," Stars: Max von Sydow, Gunnar Björnstrand, Bengt Ekerot, Nils Poppe"
Hachi: A Dog's Tale,81,Biography,2009,93,G,A college professor bonds with an abandoned dog he takes into his home.,Director: Lasse Hallström ," Stars: Richard Gere, Joan Allen, Cary-Hiroyuki Tagawa, Sarah Roemer"
Cool Hand Luke,81,Crime,1967,127,GP,"A laid-back Southern man is sentenced to two years in a rural prison, but refuses to conform.",Director: Stuart Rosenberg ," Stars: Paul Newman, George Kennedy, Strother Martin, J.D. Cannon"
Ben-Hur,81,Adventure,1959,212,G,"After a Jewish prince is betrayed and sent into slavery by a Roman friend in 1st-century Jerusalem, he regains his freedom and comes back for revenge.",Director: William Wyler ," Stars: Charlton Heston, Jack Hawkins, Stephen Boyd, Haya Harareet"
In the Name of the Father,81,Biography,1993,133,R,A man's coerced confession to an I.R.A. bombing he did not commit results in the imprisonment of his father as well. An English lawyer fights to free them.,Director: Jim Sheridan ," Stars: Daniel Day-Lewis, Pete Postlethwaite, Alison Crosbie, Philip King"
A Silent Voice: The Movie,81,Animation,2016,130,Not Rated,"A young man is ostracized by his classmates after he bullies a deaf girl to the point where she moves away. Years later, he sets off on a path for redemption.",Director: Naoko Yamada ," Stars: Miyu Irino, Saori Hayami, Aoi Yûki, Kenshô Ono"
The Bridge on the River Kwai,81,Adventure,1957,161,PG,"British POWs are forced to build a railway bridge across the river Kwai for their Japanese captors in occupied Burma, not knowing that the allied forces are planning a daring commando raid through the jungle to destroy it.",Director: David Lean ," Stars: William Holden, Alec Guinness, Jack Hawkins, Sessue Hayakawa"
The Third Man,81,Film-Noir,1949,93,Approved,"Pulp novelist Holly Martins travels to shadowy, postwar Vienna, only to find himself investigating the mysterious death of an old friend, Harry Lime.",Director: Carol Reed ," Stars: Orson Welles, Joseph Cotten, Alida Valli, Trevor Howard"
Persona,81,Drama,1966,83,Not Rated,A nurse is put in charge of a mute actress and finds that their personae are melding together.,Director: Ingmar Bergman ," Stars: Bibi Andersson, Liv Ullmann, Margaretha Krook, Gunnar Björnstrand"
Rebecca,81,Drama,1940,130,Approved,A self-conscious woman juggles adjusting to her new role as an aristocrat's wife and avoiding being intimidated by his first wife's spectral presence.,Director: Alfred Hitchcock ," Stars: Laurence Olivier, Joan Fontaine, George Sanders, Judith Anderson"
The Man Who Shot Liberty Valance,81,Drama,1962,123,Approved,A senator returns to a Western town for the funeral of an old friend and tells the story of his origins.,Director: John Ford ," Stars: James Stewart, John Wayne, Vera Miles, Lee Marvin"
On the Waterfront,81,Crime,1954,108,Approved,"An ex-prize fighter turned New Jersey longshoreman struggles to stand up to his corrupt union bosses, including his older brother, as he starts to connect with the grieving sister of one of the syndicate's victims.",Director: Elia Kazan ," Stars: Marlon Brando, Karl Malden, Lee J. Cobb, Rod Steiger"
Hotel Rwanda,81,Biography,2004,121,PG-13,"Paul Rusesabagina, a hotel manager, houses over a thousand Tutsi refugees during their struggle against the Hutu militia in Rwanda, Africa.",Director: Terry George ," Stars: Don Cheadle, Sophie Okonedo, Joaquin Phoenix, Xolani Mali"
It Happened One Night,81,Comedy,1934,105,Passed,"A renegade reporter trailing a young runaway heiress for a big story joins her on a bus heading from Florida to New York, and they end up stuck with each other when the bus leaves them behind at one of the stops.",Director: Frank Capra ," Stars: Clark Gable, Claudette Colbert, Walter Connolly, Roscoe Karns"
The 400 Blows,81,Crime,1959,99,Not Rated,"A young boy, left without attention, delves into a life of petty crime.",Director: François Truffaut ," Stars: Jean-Pierre Léaud, Albert Rémy, Claire Maurier, Guy Decomble"
Neon Genesis Evangelion: The End of Evangelion,81,Animation,1997,87,TV-MA,Concurrent theatrical ending of the TV series Neon Genesis Evangelion (1995).,"Directors: Hideaki Anno, Kazuya Tsurumaki "," Stars: Megumi Ogata, Megumi Hayashibara, Yûko Miyamura, Kotono Mitsuishi"
Tokyo Story,81,Drama,1953,136,Not Rated,"An old couple visit their children and grandchildren in the city, but receive little attention.",Director: Yasujirô Ozu ," Stars: Chishû Ryû, Chieko Higashiyama, Sô Yamamura, Setsuko Hara"
PK,81,Comedy,2014,153,Not Rated,An alien on Earth loses the only device he can use to communicate with his spaceship. His innocent nature and child-like questions force the country to evaluate the impact of there religious views on there people.,Director: Rajkumar Hirani ," Stars: Aamir Khan, Anushka Sharma, Sanjay Dutt, Boman Irani"
Paper Moon,81,Comedy,1973,102,PG,"During the Great Depression, a con man finds himself saddled with a young girl who may or may not be his daughter, and the two forge an unlikely partnership.",Director: Peter Bogdanovich ," Stars: Ryan O'Neal, Tatum O'Neal, Madeline Kahn, John Hillerman"
The Best Years of Our Lives,81,Drama,1946,170,Approved,"Three World War II veterans, two of them traumatized or disabled, return home to the American midwest to discover that they and their families have been irreparably changed.",Director: William Wyler ," Stars: Myrna Loy, Dana Andrews, Fredric March, Teresa Wright"
The Grapes of Wrath,81,Drama,1940,129,Passed,"An Oklahoma family, driven off their farm by the poverty and hopelessness of the Dust Bowl, joins the westward migration to California, suffering the misfortunes of the homeless in the Great Depression.",Director: John Ford ," Stars: Henry Fonda, Jane Darwell, John Carradine, Charley Grapewin"
Mary and Max,81,Animation,2009,92,Not Rated,"A tale of friendship between two unlikely pen pals: Mary, a lonely, eight-year-old girl living in the suburbs of Melbourne, and Max, a forty-four-year old, severely obese man living in New York.",Director: Adam Elliot ," Stars: Toni Collette, Philip Seymour Hoffman, Eric Bana, Barry Humphries"
The Celebration,81,Drama,1998,105,R,"At Helge's 60th birthday party, some unpleasant family truths are revealed.",Director: Thomas Vinterberg ," Stars: Ulrich Thomsen, Henning Moritzen, Thomas Bo Larsen, Paprika Steen"
Farewell My Concubine,81,Drama,1992,171,R,Two boys meet at an opera training school in Peking in 1924. Their resulting friendship will span nearly 70 years and endure some of the most troublesome times in China's history.,Director: Kaige Chen ," Stars: Leslie Cheung, Fengyi Zhang, Gong Li, You Ge"
OMG: Oh My God!,81,Comedy,2012,125,Not Rated,A shopkeeper takes God to court when his shop is destroyed by an earthquake.,Director: Umesh Shukla ," Stars: Paresh Rawal, Akshay Kumar, Mithun Chakraborty, Mahesh Manjrekar"
All Quiet on the Western Front,81,Drama,1930,152,Passed,"A German youth eagerly enters World War I, but his enthusiasm wanes as he gets a firsthand view of the horror.",Director: Lewis Milestone ," Stars: Lew Ayres, Louis Wolheim, John Wray, Arnold Lucy"
Three Colors: Red,81,Drama,1994,99,R,A model discovers a retired judge is keen on invading people's privacy.,Director: Krzysztof Kieslowski ," Stars: Irène Jacob, Jean-Louis Trintignant, Frédérique Feder, Jean-Pierre Lorit"
Bajrangi Bhaijaan,81,Action,2015,163,Not Rated,An Indian man with a magnanimous heart takes a young mute Pakistani girl back to her homeland to reunite her with her family.,"Directors: Kabir Khan, Mehmet Tutkun "," Stars: Salman Khan, Harshaali Malhotra, Nawazuddin Siddiqui, Kareena Kapoor"
The Red Shoes,81,Drama,1948,135,Not Rated,A young ballet dancer is torn between the man she loves and her pursuit to become a prima ballerina.,"Directors: Michael Powell, Emeric Pressburger "," Stars: Anton Walbrook, Marius Goring, Moira Shearer, Robert Helpmann"
A Woman Under the Influence,81,Drama,1974,155,R,"Although wife and mother Mabel is loved by her husband Nick, her mental illness places a strain on the marriage.",Director: John Cassavetes ," Stars: Gena Rowlands, Peter Falk, Fred Draper, Lady Rowlands"
Fanny and Alexander,81,Drama,1982,188,R,"Two young Swedish children in the 1900s experience the many comedies and tragedies of their lively and affectionate theatrical family, the Ekdahls.",Director: Ingmar Bergman ," Stars: Bertil Guve, Pernilla Allwin, Kristina Adolphson, Börje Ahlstedt"
Wild Strawberries,81,Drama,1957,91,Not Rated,"After living a life marked by coldness, an aging professor is forced to confront the emptiness of his existence.",Director: Ingmar Bergman ," Stars: Victor Sjöström, Bibi Andersson, Ingrid Thulin, Gunnar Björnstrand"
Underground,81,Comedy,1995,167,Not Rated,"A group of Serbian socialists prepares for the war in a surreal underground filled by parties, tragedies, love, and hate.",Director: Emir Kusturica ," Stars: Predrag 'Miki' Manojlovic, Lazar Ristovski, Mirjana Jokovic, Slavko Stimac"
The Battle of Algiers,81,Drama,1966,121,Not Rated,"In the 1950s, fear and violence escalate as the people of Algiers fight for independence from the French government.",Director: Gillo Pontecorvo ," Stars: Brahim Hadjadj, Jean Martin, Yacef Saadi, Samia Kerbash"
The Message,81,Biography,1976,177,PG,This epic historical drama chronicles the life and times of Prophet Muhammad and serves as an introduction to early Islamic history.,Director: Moustapha Akkad ," Stars: Anthony Quinn, Irene Papas, Michael Ansara, Johnny Sekka"
Lagaan: Once Upon a Time in India,81,Drama,2001,224,PG,The people of a small village in Victorian India stake their future on a game of cricket against their ruthless British rulers.,Director: Ashutosh Gowariker ," Stars: Aamir Khan, Raghubir Yadav, Gracy Singh, Rachel Shelley"
Dil Chahta Hai,81,Comedy,2001,183,Not Rated,"Three inseparable childhood friends are just out of college. Nothing comes between them - until they each fall in love, and their wildly different approaches to relationships creates tension.",Director: Farhan Akhtar ," Stars: Aamir Khan, Saif Ali Khan, Akshaye Khanna, Preity G Zinta"
The Hidden Fortress,81,Action,1958,126,Not Rated,"Lured by gold, two greedy peasants unknowingly escort a princess and her general across enemy lines.",Director: Akira Kurosawa ," Stars: Toshirô Mifune, Misa Uehara, Minoru Chiaki, Kamatari Fujiwara"
Yi Yi: A One and a Two...,81,Drama,2000,173,Not Rated,Each member of a middle-class Taipei family seeks to reconcile past and present relationships within their daily lives.,Director: Edward Yang ," Stars: Nien-Jen Wu, Elaine Jin, Issei Ogata, Kelly Lee"
Winter Sleep,81,Drama,2014,196,Not Rated,A hotel owner and landlord in a remote Turkish village deals with conflicts within his family and a tenant behind on his rent.,Director: Nuri Bilge Ceylan ," Stars: Haluk Bilginer, Melisa Sözen, Demet Akbag, Ayberk Pekcan"
Andrei Rublev,81,Biography,1966,205,R,"The life, times and afflictions of the fifteenth-century Russian iconographer St. Andrei Rublev.",Director: Andrei Tarkovsky ," Stars: Anatoliy Solonitsyn, Ivan Lapikov, Nikolay Grinko, Nikolay Sergeev"
Mr. Smith Goes to Washington,81,Comedy,1939,129,Passed,"A naive youth leader is appointed to fill a vacancy in the U.S. Senate. His idealistic plans promptly collide with corruption at home and subterfuge from his hero in Washington, but he tries to forge ahead despite attacks on his character.",Director: Frank Capra ," Stars: James Stewart, Jean Arthur, Claude Rains, Edward Arnold"
Diabolique,81,Crime,1955,117,Not Rated,The wife and mistress of a loathed school principal plan to murder him with what they believe is the perfect alibi.,Director: Henri-Georges Clouzot ," Stars: Simone Signoret, Véra Clouzot, Paul Meurisse, Charles Vanel"
The Passion of Joan of Arc,81,Biography,1928,114,Passed,"In 1431, Jeanne d'Arc is placed on trial on charges of heresy. The ecclesiastical jurists attempt to force Jeanne to recant her claims of holy visions.",Director: Carl Theodor Dreyer ," Stars: Maria Falconetti, Eugene Silvain, André Berley, Maurice Schutz"
The General,81,Action,1926,78,Passed,"After being rejected by the Confederate military, not realizing it was due to his crucial civilian role, an engineer must single-handedly recapture his beloved locomotive after it is seized by Union spies and return it through enemy lines.","Directors: Clyde Bruckman, Buster Keaton "," Stars: Buster Keaton, Marion Mack, Glen Cavender, Jim Farley"
Sunrise,81,Drama,1927,94,Passed,"A sophisticated city woman seduces a farmer and convinces him to murder his wife and join her in the city, but he ends up rekindling his romance with his wife when he changes his mind at the last moment.",Director: F.W. Murnau ," Stars: George O'Brien, Janet Gaynor, Margaret Livingston, Bodil Rosing"
Inherit the Wind,81,Biography,1960,128,Passed,"Based on a real-life case in 1925, two great lawyers argue the case for and against a Tennessee science teacher accused of the crime of teaching evolution.",Director: Stanley Kramer ," Stars: Spencer Tracy, Fredric March, Gene Kelly, Dick York"
Munna Bhai M.B.B.S.,81,Comedy,2003,156,Not Rated,A gangster sets out to fulfill his father's dream of becoming a doctor.,Director: Rajkumar Hirani ," Stars: Sanjay Dutt, Arshad Warsi, Gracy Singh, Boman Irani"
Autumn Sonata,81,Drama,1978,99,PG,"A devoted wife is visited by her mother, a successful concert pianist who had little time for her when she was young.",Director: Ingmar Bergman ," Stars: Ingrid Bergman, Liv Ullmann, Lena Nyman, Halvar Björk"
The Gold Rush,81,Adventure,1925,95,Passed,"A prospector goes to the Klondike during the 1890s gold rush in hopes of making his fortune, and is smitten with a girl he sees in a dance hall.",Director: Charles Chaplin ," Stars: Charles Chaplin, Mack Swain, Tom Murray, Henry Bergman"
Throne of Blood,81,Drama,1957,110,Not Rated,"A war-hardened general, egged on by his ambitious wife, works to fulfill a prophecy that he would become lord of Spider's Web Castle.",Director: Akira Kurosawa ," Stars: Toshirô Mifune, Minoru Chiaki, Isuzu Yamada, Takashi Shimura"
A Wednesday,81,Action,2008,104,Not Rated,A retiring police officer reminisces about the most astounding day of his career. About a case that was never filed but continues to haunt him in his memories - the case of a man and a Wednesday.,Director: Neeraj Pandey ," Stars: Anupam Kher, Naseeruddin Shah, Veerendra Saxena, Mahesh Kanual"
Wolf Children,81,Animation,2012,117,PG,"After her werewolf lover unexpectedly dies in an accident while hunting for food for their children, a young woman must find ways to raise the werewolf son and daughter that she had with him while keeping their trait hidden from society.",Director: Mamoru Hosoda ," Stars: Aoi Miyazaki, Takao Osawa, Haru Kuroki, Yukito Nishii"
The Virgin Spring,81,Drama,1960,89,Not Rated,"In 14th-century Sweden, an innocent yet pampered teenage girl and her family's pregnant and jealous servant set out from their farm to deliver candles to church, but only one returns from events that transpire in the woods along the way.",Director: Ingmar Bergman ," Stars: Max von Sydow, Birgitta Valberg, Gunnel Lindblom, Birgitta Pettersson"
Nights of Cabiria,81,Drama,1957,110,Not Rated,A waifish prostitute wanders the streets of Rome looking for true love but finds only heartbreak.,Director: Federico Fellini ," Stars: Giulietta Masina, François Périer, Franca Marzi, Dorian Gray"
Raise the Red Lantern,81,Drama,1991,125,PG,"A young woman becomes the fourth wife of a wealthy lord, and must learn to live with the strict rules and tensions within the household.",Director: Yimou Zhang ," Stars: Gong Li, Jingwu Ma, Saifei He, Cuifen Cao"
Barfi!,81,Comedy,2012,151,Not Rated,Three young people learn that love can neither be defined nor contained by society's definition of normal and abnormal.,Director: Anurag Basu ," Stars: Ranbir Kapoor, Priyanka Chopra Jonas, Ileana D'Cruz, Saurabh Shukla"
Time of the Gypsies,81,Comedy,1988,142,R,"In this luminous tale set in the area around Sarajevo and in Italy, Perhan, an engaging young Romany (gypsy) with telekinetic powers, is seduced by the quick-cash world of petty crime, which threatens to destroy him and those he loves.",Director: Emir Kusturica ," Stars: Davor Dujmovic, Bora Todorovic, Ljubica Adzovic, Husnija Hasimovic"
Rififi,81,Crime,1955,118,Not Rated,"Four men plan a technically perfect crime, but the human element intervenes...",Director: Jules Dassin ," Stars: Jean Servais, Carl Möhner, Robert Manuel, Janine Darcey"
White Heat,81,Action,1949,114,Not Rated,A psychopathic criminal with a mother complex makes a daring break from prison and leads his old gang in a chemical plant payroll heist.,Director: Raoul Walsh ," Stars: James Cagney, Virginia Mayo, Edmond O'Brien, Margaret Wycherly"
The Grand Illusion,81,Drama,1937,113,Not Rated,"During WWI, two French soldiers are captured and imprisoned in a German P.O.W. camp. Several escape attempts follow until they are eventually sent to a seemingly inescapable fortress.",Director: Jean Renoir ," Stars: Jean Gabin, Dita Parlo, Pierre Fresnay, Erich von Stroheim"
Ace in the Hole,81,Drama,1951,111,Approved,"A frustrated former big-city journalist now stuck working for an Albuquerque newspaper exploits a story about a man trapped in a cave to rekindle his career, but the situation quickly escalates into an out-of-control circus.",Director: Billy Wilder ," Stars: Kirk Douglas, Jan Sterling, Robert Arthur, Porter Hall"
Rang De Basanti,81,Comedy,2006,167,Not Rated,"The story of six young Indians who assist an English woman to film a documentary on the freedom fighters from their past, and the events that lead them to relive the long-forgotten saga of freedom.",Director: Rakeysh Omprakash Mehra ," Stars: Aamir Khan, Soha Ali Khan, Siddharth, Sharman Joshi"
Kahaani,81,Mystery,2012,122,Not Rated,"A pregnant woman's search for her missing husband takes her from London to Kolkata, but everyone she questions denies having ever met him.",Director: Sujoy Ghosh ," Stars: Vidya Balan, Parambrata Chattopadhyay, Indraneil Sengupta, Nawazuddin Siddiqui"
Jean de Florette,81,Comedy,1986,120,PG,A greedy landowner and his backward nephew conspire to block the only water source for an adjoining property in order to bankrupt the owner and force him to sell.,Director: Claude Berri ," Stars: Yves Montand, Gérard Depardieu, Daniel Auteuil, Elisabeth Depardieu"
Talvar,81,Crime,2015,132,Not Rated,An experienced investigator confronts several conflicting theories about the perpetrators of a violent double homicide.,Director: Meghna Gulzar ," Stars: Irrfan Khan, Konkona Sen Sharma, Neeraj Kabi, Sohum Shah"
Chak De! India,81,Drama,2007,153,Not Rated,"Kabir Khan, the coach of the Indian Women's National Hockey Team, dreams of making his all-girls team emerge victorious against all odds.",Director: Shimit Amin ," Stars: Shah Rukh Khan, Vidya Malvade, Sagarika Ghatge, Shilpa Shukla"
Pink,81,Crime,III 2016,136,Not Rated,"When three young women are implicated in a crime, a retired lawyer steps forward to help them clear their names.",Director: Aniruddha Roy Chowdhury ," Stars: Amitabh Bachchan, Taapsee Pannu, Kirti Kulhari, Andrea Tariang"
Udaan,81,Drama,2010,134,Not Rated,"Expelled from his school, a 16-year old boy returns home to his abusive and oppressive father.",Director: Vikramaditya Motwane ," Stars: Rajat Barmecha, Ronit Roy, Manjot Singh, Ram Kapoor"
Article 15,81,Crime,2019,130,Not Rated,"In the rural heartlands of India, an upright police officer sets out on a crusade against violent caste-based crimes and discrimination.",Director: Anubhav Sinha ," Stars: Ayushmann Khurrana, Nassar, Manoj Pahwa, Kumud Mishra"
Sholay,81,Action,1975,162,Not Rated,"After his family is murdered by a notorious and ruthless bandit, a former police officer enlists the services of two outlaws to capture the bandit.",Director: Ramesh Sippy ," Stars: Sanjeev Kumar, Dharmendra, Amitabh Bachchan, Amjad Khan"
Viridiana,81,Drama,1961,91,Not Rated,"Viridiana, a young nun about to take her final vows, pays a visit to her widowed uncle at the request of her Mother Superior.",Director: Luis Buñuel ," Stars: Silvia Pinal, Francisco Rabal, Fernando Rey, José Calvo"
Anand,81,Drama,1971,122,Not Rated,"The story of a terminally ill man who wishes to live life to the fullest before the inevitable occurs, as told by his best friend.",Director: Hrishikesh Mukherjee ," Stars: Rajesh Khanna, Amitabh Bachchan, Sumita Sanyal, Ramesh Deo"
The Bandit,81,Crime,1996,128,Not Rated,"Baran the Bandit, released from prison after 35 years, searches for vengeance and his lover.",Director: Yavuz Turgul ," Stars: Sener Sen, Ugur Yücel, Sermin Hürmeriç, Yesim Salkim"
Tangerines,81,Drama,2013,87,Not Rated,"In 1992, war rages in Abkhazia, a breakaway region of Georgia. An Estonian man Ivo has decided to stay behind and harvest his crops of tangerines. In a bloody conflict at his door, a wounded man is left behind, and Ivo takes him in.",Director: Zaza Urushadze ," Stars: Lembit Ulfsak, Elmo Nüganen, Giorgi Nakashidze, Misha Meskhi"
Sarfarosh,81,Action,1999,174,Not Rated,"After his brother is killed and father severely injured by terrorists, a young med student quits his studies to join the Indian Police Service to wipe out the terrorists.",Director: John Mathew Matthan ," Stars: Naseeruddin Shah, Aamir Khan, Sonali Bendre, Mukesh Rishi"
Hera Pheri,81,Action,2000,156,Not Rated,"Three unemployed men look for answers to all their money problems - but when their opportunity arrives, will they know what to do with it?",Director: Priyadarshan ," Stars: Akshay Kumar, Suniel Shetty, Paresh Rawal, Tabu"
Queen,81,Adventure,2013,146,Not Rated,A Delhi girl from a traditional family sets out on a solo honeymoon after her marriage gets cancelled.,Director: Vikas Bahl ," Stars: Kangana Ranaut, Rajkummar Rao, Lisa Haydon, Jeffrey Ho"
The Circus,81,Comedy,1928,72,Passed,The Tramp finds work and the girl of his dreams at a circus.,Director: Charles Chaplin ," Stars: Charles Chaplin, Merna Kennedy, Al Ernest Garcia, Harry Crocker"
Black,81,Drama,2005,122,Not Rated,"The cathartic tale of a young woman who can't see, hear, or speak, and the teacher who brings a ray of light into her dark world.",Director: Sanjay Leela Bhansali ," Stars: Amitabh Bachchan, Rani Mukerji, Shernaz Patel, Ayesha Kapur"
Everything's Gonna Be Great,81,Comedy,1998,107,7+,"When Altan swipes prescription drugs from his brother Nuri's pharmacy, they soon find themselves on a dangerous but funny road trip to get rid of the stuff and escape the mafiosi Altan ... See full summary »",Director: Ömer Vargi ," Stars: Cem Yilmaz, Mazhar Alanson, Ceyda Düvenci, Selim Nasit"
Dune,80,Action,2021,155,PG-13,A noble family becomes embroiled in a war for control over the galaxy's most valuable asset while its heir becomes troubled by visions of a dark future.,Director: Denis Villeneuve ," Stars: Timothée Chalamet, Rebecca Ferguson, Zendaya, Oscar Isaac"
Blade Runner 2049,80,Action,2017,164,R,"Young Blade Runner K's discovery of a long-buried secret leads him to track down former Blade Runner Rick Deckard, who's been missing for thirty years.",Director: Denis Villeneuve ," Stars: Harrison Ford, Ryan Gosling, Ana de Armas, Dave Bautista"
Black Swan,80,Drama,2010,108,R,"Nina is a talented but unstable ballerina on the verge of stardom. Pushed to the breaking point by her artistic director and a seductive rival, Nina's grip on reality slips, plunging her into a waking nightmare.",Director: Darren Aronofsky ," Stars: Natalie Portman, Mila Kunis, Vincent Cassel, Winona Ryder"
Guardians of the Galaxy,80,Action,2014,121,PG-13,A group of intergalactic criminals must pull together to stop a fanatical warrior with plans to purge the universe.,Director: James Gunn ," Stars: Chris Pratt, Vin Diesel, Bradley Cooper, Zoe Saldana"
The Princess Bride,80,Adventure,1987,98,PG,"A bedridden boy's grandfather reads him the story of a farmboy-turned-pirate who encounters numerous obstacles, enemies and allies in his quest to be reunited with his true love.",Director: Rob Reiner ," Stars: Cary Elwes, Mandy Patinkin, Robin Wright, Chris Sarandon"
